{
  "id": "alice-in-wonderland",
  "name": "Alice in Wonderland",
  "description": "A whimsical journey through a twisted wonderland filled with curious characters and magical encounters",
  "startLocationId": "rabbit-hole-entrance",
  "locations": [
    {
      "id": "rabbit-hole-entrance",
      "name": "Rabbit Hole Entrance",
      "description": "You stand at the entrance of a mysterious rabbit hole beneath a grand old oak tree. The air shimmers with an otherworldly quality, and you can hear faint music drifting up from below. A worn wooden sign reads 'Down the Rabbit Hole - Mind Your Step!' The entrance beckons invitingly, promising adventure and mystery.",
      "exits": [
        {
          "direction": "down",
          "targetLocationId": "pool-of-tears"
        }
      ],
      "characters": [
        {
          "id": "white-rabbit",
          "name": "White Rabbit",
          "dialogue": [],
          "isAiPowered": true,
          "personality": "You are the White Rabbit, a perpetually anxious and hurried creature obsessed with time. You're always late for something important and frequently check your pocket watch. You speak in a flustered, rushed manner, often exclaiming 'Oh dear!' and 'I'm late!' You're worried about the Queen's wrath and mention the trial frequently. Despite your anxiety, you're helpful to visitors.",
          "aiConfig": {
            "temperature": 0.8,
            "maxTokens": 70
          }
        }
      ],
      "items": [
        {
          "id": "pocket-watch",
          "name": "Broken Pocket Watch",
          "description": "A golden pocket watch that ticks backwards. The hands spin wildly, never settling on any particular time."
        }
      ]
    },
    {
      "id": "pool-of-tears",
      "name": "Pool of Tears",
      "description": "You find yourself in a vast hall with a tiny door at one end. The floor is flooded with tears, creating a shimmering pool that reflects distorted images of the ceiling above. Various creatures swim about - a mouse, a duck, a dodo, and several other curious animals. Bottles labeled 'DRINK ME' and cakes labeled 'EAT ME' sit on a glass table nearby.",
      "exits": [
        {
          "direction": "up",
          "targetLocationId": "rabbit-hole-entrance"
        },
        {
          "direction": "east",
          "targetLocationId": "white-rabbit-house"
        },
        {
          "direction": "west",
          "targetLocationId": "mushroom-meadow"
        }
      ],
      "characters": [
        {
          "id": "dodo",
          "name": "Dodo Bird",
          "dialogue": [],
          "isAiPowered": true,
          "personality": "You are the Dodo Bird, a pompous and self-important creature who speaks with great authority on all matters. You're fond of organizing activities like the Caucus Race and explaining things in an overly complicated way. You use formal language and consider yourself quite intelligent. You're not unkind, just rather full of yourself.",
          "aiConfig": {
            "temperature": 0.8,
            "maxTokens": 70
          }
        }
      ],
      "items": [
        {
          "id": "drink-me-bottle",
          "name": "Bottle labeled DRINK ME",
          "description": "A small glass bottle with a paper label. The liquid inside tastes like cherry tart, custard, pineapple, and roast turkey."
        },
        {
          "id": "eat-me-cake",
          "name": "Cake labeled EAT ME",
          "description": "A small cake with currants spelling out 'EAT ME' in elegant script. It smells delightfully sweet."
        }
      ]
    },
    {
      "id": "white-rabbit-house",
      "name": "White Rabbit's House",
      "description": "A cozy cottage with a thatched roof and a brass nameplate reading 'W. RABBIT'. Inside, everything is neat and orderly - too orderly, perhaps. The walls are covered with clocks of every size and shape, all ticking at different speeds. A narrow staircase leads up to a cramped bedroom, and there's a small garden visible through the back window.",
      "exits": [
        {
          "direction": "west",
          "targetLocationId": "pool-of-tears"
        },
        {
          "direction": "north",
          "targetLocationId": "duchess-kitchen"
        }
      ],
      "characters": [
        {
          "id": "bill-the-lizard",
          "name": "Bill the Lizard",
          "dialogue": [],
          "isAiPowered": true,
          "personality": "You are Bill the Lizard, a hardworking but unfortunate chimney sweep who's constantly being called upon for difficult tasks. You speak with a working-class accent and often complain (good-naturedly) about being kicked out of chimneys or asked to do impossible things. You're loyal and helpful despite your misfortunes.",
          "aiConfig": {
            "temperature": 0.8,
            "maxTokens": 70
          }
        }
      ],
      "items": [
        {
          "id": "white-gloves",
          "name": "White Kid Gloves",
          "description": "A pair of pristine white gloves, perfectly sized for a rabbit. They smell faintly of lavender."
        },
        {
          "id": "fan",
          "name": "Ornate Fan",
          "description": "An elegant fan decorated with painted roses. Waving it seems to make you feel smaller."
        }
      ]
    },
    {
      "id": "mushroom-meadow",
      "name": "Mushroom Meadow",
      "description": "A clearing filled with enormous mushrooms of every color imaginable - spotted red and white, deep purple, glowing blue, and shimmering gold. Some are as tall as trees, others as small as buttons. The air is thick with spores that sparkle in the dappled sunlight. One particularly large mushroom in the center has someone sitting on top of it.",
      "exits": [
        {
          "direction": "east",
          "targetLocationId": "pool-of-tears"
        },
        {
          "direction": "north",
          "targetLocationId": "caterpillar-mushroom-top"
        },
        {
          "direction": "south",
          "targetLocationId": "cheshire-cats-tree"
        }
      ],
      "characters": [
        {
          "id": "pigeon",
          "name": "Pigeon",
          "dialogue": [],
          "isAiPowered": true,
          "personality": "You are a Pigeon, paranoid and convinced that everyone is a serpent trying to steal your eggs. You're defensive and accusatory, but also somewhat comical in your single-minded obsession. You see serpents everywhere and interpret everything as a threat to your nest.",
          "aiConfig": {
            "temperature": 0.8,
            "maxTokens": 70
          }
        }
      ],
      "items": [
        {
          "id": "mushroom-piece",
          "name": "Piece of Mushroom",
          "description": "A chunk broken from a large mushroom. One side makes you grow, the other makes you shrink. Which is which?"
        }
      ]
    },
    {
      "id": "caterpillar-mushroom-top",
      "name": "Caterpillar's Mushroom Top",
      "description": "Atop the largest mushroom sits a blue caterpillar, smoking a hookah with a long, curling pipe. Smoke rings drift lazily through the air, forming shapes of letters and symbols. The caterpillar regards you with an expression of supreme indifference, as if you're merely another curiosity in an already curious world.",
      "exits": [
        {
          "direction": "south",
          "targetLocationId": "mushroom-meadow"
        }
      ],
      "characters": [
        {
          "id": "caterpillar",
          "name": "Caterpillar",
          "dialogue": [],
          "isAiPowered": true,
          "personality": "You are the Caterpillar, a philosophical and somewhat condescending creature who speaks in cryptic questions. You are obsessed with identity and transformation. You speak slowly and deliberately, often asking 'Who are YOU?' You give advice about the mushroom's properties but in a roundabout way. You are not unkind, but you have little patience for foolishness.",
          "aiConfig": {
            "temperature": 0.7,
            "maxTokens": 70
          }
        }
      ],
      "items": [
        {
          "id": "hookah",
          "name": "Ornate Hookah",
          "description": "A beautiful hookah with intricate brass fittings. The smoke it produces forms words and pictures in the air."
        }
      ]
    },
    {
      "id": "cheshire-cats-tree",
      "name": "Cheshire Cat's Tree",
      "description": "An ancient oak tree with gnarled branches that seem to twist into impossible shapes. A wide grin appears and disappears among the leaves, sometimes attached to a cat, sometimes floating on its own. The air here shimmers with mischief and magic. Paths lead in multiple directions, though they seem to shift when you're not looking directly at them.",
      "exits": [
        {
          "direction": "north",
          "targetLocationId": "mushroom-meadow"
        },
        {
          "direction": "east",
          "targetLocationId": "duchess-kitchen"
        },
        {
          "direction": "west",
          "targetLocationId": "mad-hatter-tea-party"
        }
      ],
      "characters": [
        {
          "id": "cheshire-cat",
          "name": "Cheshire Cat",
          "dialogue": [],
          "isAiPowered": true,
          "personality": "You are the Cheshire Cat, a mischievous and enigmatic feline who speaks in riddles and paradoxes. You appear and disappear at will, often leaving just your grin behind. You find everything amusing and offer cryptic advice about directions and destinations. You're fond of saying that everyone here is mad. You're playful but never malicious, and you have a particular interest in the Queen's croquet game and the Mad Hatter's tea party.",
          "aiConfig": {
            "temperature": 0.9,
            "maxTokens": 70
          }
        }
      ],
      "items": [
        {
          "id": "grin",
          "name": "Disembodied Grin",